{
  "schema": "deskbot.expression_master_library/v1",
  "version": 1,
  "display": {
    "width": 360,
    "height": 360,
    "shape": "circle",
    "alignment_px": 4,
    "notes": "新资源以 360x360 圆屏为制作画布，按 4px 网格布置；官方旧 EAF 可为局部精灵，由 layout.json 镜像/裁剪合成，不能仅按 EAF 宽高判定兼容。"
  },
  "collections": [
    {
      "id": "official-vocat",
      "origin": "official_device",
      "format": "eaf",
      "source": {
        "root": "tmp/remote-esp-vocat/examples/xiaozhi-esp32",
        "manifest": "main/boards/esp_vocat/assets/360_360/emote.json",
        "asset_directory": "main/boards/esp_vocat/assets/emoji_large",
        "commit": "46d427255756fe2a148777ea3f256b615b52e160",
        "layout": "main/boards/esp_vocat/assets/360_360/layout.json",
        "listening_asset": "listen.eaf",
        "package_sha256": "56b39e7fdd14b9dd0de9b22d3aedc9b04383376dbdef70925675f639d763cd5b",
        "partition_table": "partitions/v2/16m.csv"
      },
      "compatibility": "current_esp_vocat_player",
      "device_package_eligible": true,
      "notes": "官方小智喵伴资源；容量以构建出的 expression_assets.bin 为准。"
    },
    {
      "id": "espressif-emote-gen-sample",
      "origin": "research_only",
      "format": "mmap_emote_assets_v1",
      "source": {
        "bundle": "tmp/research-emote-tool/emote_assets.bin",
        "inspection": "tmp/research-emote-tool/sample-inspection.json",
        "player": "tmp/research-esp-emote-gen-player",
        "library": "esp_emote_gfx ^3.0.0",
        "package_sha256": "d7e870cf77dbed4f0d9e751904ae97d69dd0cc0729de33d947e5b96a12d97bdc",
        "upstream": "https://github.com/espressif2022/esp_emote_gen_player",
        "bundle_url": "https://dl.espressif.com/AE/emote_assets.bin",
        "source_archive_url": "https://dl.espressif.com/AE/Emote%20Pack.zip",
        "source_archive": "tmp/research-emote-tool/Emote-Pack.zip",
        "source_archive_sha256": "946654de50253949b2c687a2b6b53bf3b66fdd699ab107950258e2a830cf15e6",
        "packer_url": "https://emote-gfx-gen-tool-dev.pages.dev/"
      },
      "compatibility": "research_player_encoding_3",
      "device_package_eligible": false,
      "notes": "乐鑫示例素材和播放器研究输入；不直接刷入当前喵伴 assets 分区。"
    }
  ],
  "policy": {
    "official_baseline_immutable": true,
    "research_is_not_device_input": true,
    "candidate_requires_capacity_audit": true,
    "candidate_requires_hash_and_regression": true,
    "keep_source_and_ai_originals": true
  }
}
